{
  "envVersion": "pqctoday.execution-environment/1",
  "recordedAt": "2026-09-25T15:34:47.652Z",
  "target": {
    "id": "linux-arm64-rust",
    "label": "Native Linux Arm64 — Rust engine",
    "class": "native"
  },
  "os": {
    "name": "Debian GNU/Linux 13 (trixie)",
    "version": "13",
    "kernel": "Linux 7.0.14-orbstack-00380-ga7e0a2dc9535",
    "image": {
      "name": "rust:1",
      "id": "sha256:c6811167278337db5f3b0234964ced5f538f154a2a20f09ec03721d7411c933d"
    }
  },
  "arch": {
    "machine": "aarch64",
    "pointerBits": 64,
    "endianness": "little"
  },
  "cpu": {
    "model": "ARMv8 CPU implementer 0x61 (Apple) part 0x000",
    "board": null,
    "features": "fp asimd evtstrm aes pmull sha1 sha2 crc32 atomics fphp asimdhp cpuid asimdrdm jscvt fcma lrcpc dcpop sha3 asimddp sha512 asimdfhm dit uscat ilrcpc flagm sb dcpodp flagm2 frint i8mm bf16 ecv afp sme smei16i64 smef64f64 smei8i32 smef16f32 smeb16f32 smef32f32 ebf16 sme2 sme2p1 smei16i32 smebi32i32 smeb16b16 smef16f16"
  },
  "emulation": {
    "emulated": false,
    "mechanism": null,
    "hostMachine": "arm64 (Apple M5 Max, macOS 26.6.2, OrbStack)",
    "detection": "/proc/self/maps rosetta mapping: absent; cpuinfo vendor_id: None"
  },
  "engine": {
    "id": "rust",
    "implementation": "pqctoday-hsm softhsmrustv3 (Rust), native cdylib libsofthsmrustv3.so",
    "artifactKind": "shared-library",
    "artifactPath": "/tmp/acvp-h-51913/engine/linux-arm64-libsofthsmrustv3.so",
    "artifactSha256": "e3cf1bd4dfd21d42c465f1d7191df063301b31ab1a983b48481325a6a04c0485",
    "sourceRepository": "https://github.com/pqctoday-org/pqctoday-hsm",
    "sourceCommit": "417c47a224a9859a4a02b90700ca0cdeb30cfebc",
    "sourceCommitEvidence": "Built from a clean detached worktree created for this run (git -C pqctoday-hsm worktree add --detach pqctoday-hsm-acvp-h-417c47a2 417c47a2; git status clean before and after, worktree removed afterwards). Same commit the Rust WASM bundle is anchored to (wasm-provenance.json softhsmrustv3-engine._reanchor20260923: byte-identical rebuild).",
    "builtAt": "2026-09-25T02:42Z"
  },
  "build": {
    "buildSystem": "cargo 1.96.0: cargo build --release --locked --offline -p softhsmrustv3 --lib",
    "compiler": "rustc 1.96.0 (ac68faa20 2026-05-25) (ELF .comment also lists GCC 14.2.0 and clang 22.1.0-rc2 for C build-deps)",
    "flags": "RUSTFLAGS unset",
    "profile": "release (opt-level=\"s\", lto=true — rust/Cargo.toml [profile.release])",
    "features": "default (no acvp, no hw-accel) — the shipped native feature set; the WASM bundle additionally enables acvp (C_Initialize pReserved RNG-seeding hook, unused: both runners pass NULL)",
    "location": "pqc-rust container (image rust:1 sha256:c6811167278337db5f3b0234964ced5f538f154a2a20f09ec03721d7411c933d, linux/arm64, OrbStack Linux VM on Apple M5 Max) — native arm64, not emulated; private CARGO_TARGET_DIR / CMake build dir under /tmp/acvp-h-9241, removed after the runs"
  },
  "dependencies": {
    "openssl": {
      "linked": false,
      "version": null,
      "source": "no libcrypto mapped into the runner process after loading /tmp/acvp-h-51913/engine/linux-arm64-libsofthsmrustv3.so (/proc/self/maps)"
    },
    "cryptoBackend": {
      "name": "RustCrypto ml-kem (patched: rust/ml-kem-patched) + fips204 (patched: rust/fips204-patched)",
      "version": "ml-kem 0.2.3, fips204 0.4.6 (rust/Cargo.lock @ 417c47a2)"
    },
    "runtime": [
      {
        "name": "python",
        "version": "3.13.5"
      },
      {
        "name": "libc",
        "version": "glibc 2.41"
      }
    ]
  },
  "acceleration": {
    "state": "none",
    "detail": "no hardware accelerator (no FPGA/NPU/crypto offload); CPU ISA extensions only"
  },
  "entropy": {
    "source": "getrandom crate → getrandom(2)",
    "exercisedByTestedOperations": false
  },
  "runner": {
    "name": "pqctoday acvp-native (Python/ctypes)",
    "version": "2.1.0",
    "language": "python",
    "languageVersion": "3.13.5"
  },
  "fixtureBundle": {
    "manifestSha256": "966ec2faeba6d85fe862b3bead4f0aebf47b784cecd472c2e5fb3a30905f444f",
    "schemaId": "ML-DSA/sigVer/FIPS204",
    "vsId": 42
  },
  "notes": [
    "aws-lc-rs 1.18.0 (aws-lc-sys 0.44.0) is statically linked for the RSA / NIST-curve ECDH fast path only (rust/src/crypto/awslc.rs); ML-KEM decapsulation and ML-DSA verification run on the pure-Rust crates.",
    "hw-accel feature OFF: no FPGA/NPU offload path is compiled in.",
    "Run 2026-09-25-native re-uses the exact artifact built for run 2026-09-24 (SHA-256 e3cf1bd4dfd21d42c465f1d7191df063301b31ab1a983b48481325a6a04c0485, bit-reproducible build), kept outside the container and re-staged with run-in-container.sh --module-from-host.",
    "C_GetInfo: cryptoki 3.2, manufacturer 'SoftHSMv3 Rust WASM', library 'PQC PKCS#11 v3.2 Rust WASM' 3.0"
  ],
  "envId": "eaadbfe362c000094d78bba3add52bf97bead6646ea7bb92d2734900c346b01c"
}
