{
  "envVersion": "pqctoday.execution-environment/1",
  "recordedAt": "2026-09-25T03:39:39.863Z",
  "target": {
    "id": "linux-arm64-cpp",
    "label": "Native Linux Arm64 — C++ engine",
    "class": "native"
  },
  "os": {
    "name": "Debian GNU/Linux 13 (trixie)",
    "version": "13",
    "kernel": "Linux 7.0.14-orbstack-00380-ga7e0a2dc9535",
    "image": {
      "name": "rust:1",
      "id": "sha256:c6811167278337db5f3b0234964ced5f538f154a2a20f09ec03721d7411c933d"
    }
  },
  "arch": {
    "machine": "aarch64",
    "pointerBits": 64,
    "endianness": "little"
  },
  "cpu": {
    "model": "ARMv8 CPU implementer 0x61 (Apple) part 0x000",
    "board": null,
    "features": "fp asimd evtstrm aes pmull sha1 sha2 crc32 atomics fphp asimdhp cpuid asimdrdm jscvt fcma lrcpc dcpop sha3 asimddp sha512 asimdfhm dit uscat ilrcpc flagm sb dcpodp flagm2 frint i8mm bf16 ecv afp sme smei16i64 smef64f64 smei8i32 smef16f32 smeb16f32 smef32f32 ebf16 sme2 sme2p1 smei16i32 smebi32i32 smeb16b16 smef16f16"
  },
  "emulation": {
    "emulated": false,
    "mechanism": null,
    "hostMachine": "arm64 (Apple M5 Max, macOS 26.6.2, OrbStack)",
    "detection": "/proc/self/maps rosetta mapping: absent; cpuinfo vendor_id: None"
  },
  "engine": {
    "id": "cpp",
    "implementation": "pqctoday-hsm softhsmv3 C++ (OpenSSL 3.6 backend), native shared library libsofthsmv3.so",
    "artifactKind": "shared-library",
    "artifactPath": "/tmp/acvp-h-86356/engine/linux-arm64-libsofthsmv3.so",
    "artifactSha256": "ba5d00acf9a44a3937420e09d11700616a4ae966ce2976457ce257cf1f0ab3a9",
    "sourceRepository": "https://github.com/pqctoday-org/pqctoday-hsm",
    "sourceCommit": "7795799b91c61097cb6cd28704c0ca1ab114a4c7",
    "sourceCommitEvidence": "Built from a clean detached worktree created for this run (git -C pqctoday-hsm worktree add --detach pqctoday-hsm-acvp-h-7795799b 7795799b…; git status clean before and after the build, worktree removed afterwards). Gitlink submodules hash-sigs @21294a0f and xmss-reference @171ccbd2 populated with `git archive <gitlink sha>` from the local submodule repos; liboqs not needed (WITH_LIBOQS=OFF). Same commit as the C++ WASM bundle (wasm-provenance.json softhsm-cpp-engine).",
    "builtAt": "2026-09-25T02:42Z"
  },
  "build": {
    "buildSystem": "CMake 3.31.6, out-of-tree, target softhsmv3",
    "compiler": "c++ (Debian 14.2.0-19) 14.2.0 (ELF .comment: GCC: (Debian 14.2.0-19) 14.2.0)",
    "flags": "-DCMAKE_BUILD_TYPE=Release (-O3 -DNDEBUG) -DWITH_CRYPTO_BACKEND=openssl -DBUILD_TESTS=OFF -DENABLE_STATIC=OFF -DWITH_LIBOQS=OFF -DOPENSSL_ROOT_DIR=/usr/local/ssl",
    "profile": "Release",
    "features": "WITH_LIBOQS=OFF (Classic McEliece only; matches the WASM build, where Emscripten forces it off)",
    "location": "pqc-rust container (image rust:1 sha256:c6811167278337db5f3b0234964ced5f538f154a2a20f09ec03721d7411c933d, linux/arm64, OrbStack Linux VM on Apple M5 Max) — native arm64, not emulated; private CARGO_TARGET_DIR / CMake build dir under /tmp/acvp-h-9241, removed after the runs"
  },
  "dependencies": {
    "openssl": {
      "linked": true,
      "version": "OpenSSL 3.6.3 9 Jun 2026",
      "source": "OpenSSL_version(OPENSSL_VERSION) of /usr/local/ssl/lib/libcrypto.so.3, the only libcrypto mapped after loading the module"
    },
    "cryptoBackend": {
      "name": "OpenSSL libcrypto (EVP)",
      "version": "OpenSSL 3.6.3 9 Jun 2026"
    },
    "runtime": [
      {
        "name": "python",
        "version": "3.13.5"
      },
      {
        "name": "libc",
        "version": "glibc 2.41"
      }
    ]
  },
  "acceleration": {
    "state": "none",
    "detail": "no hardware accelerator (no FPGA/NPU/crypto offload); CPU ISA extensions only; OpenSSL CPUINFO: OPENSSL_armcap=0x8fd"
  },
  "entropy": {
    "source": "OpenSSL 3.6.3 default DRBG, seeded from getrandom(2)",
    "exercisedByTestedOperations": false
  },
  "runner": {
    "name": "pqctoday acvp-native (Python/ctypes)",
    "version": "2.0.0",
    "language": "python",
    "languageVersion": "3.13.5"
  },
  "fixtureBundle": {
    "manifestSha256": "d2ea5cd41c49bb156a0301ce033c09a12ccf61837a8edbecd1f9fcdbf8f702fd",
    "schemaId": "ML-KEM/encapDecap/FIPS203",
    "vsId": 42
  },
  "notes": [
    "OpenSSL: /usr/local/ssl OpenSSL 3.6.3 (built 2026-08-26 in the pqc-rust container, linux-aarch64, -O3); the module's RUNPATH resolves libcrypto.so.3 there.",
    "Run 2026-09-24b re-uses the exact artifact built for run 2026-09-24 (SHA-256 ba5d00acf9a44a3937420e09d11700616a4ae966ce2976457ce257cf1f0ab3a9, bit-reproducible build), kept outside the container and re-staged with run-in-container.sh --module-from-host.",
    "C_GetInfo: cryptoki 3.2, manufacturer 'SoftHSM', library 'Implementation of PKCS11' 3.0"
  ],
  "envId": "0e40c7a8e67bc5d7afb8622758666c3750185f9b6c1508ef8b1affc42fe4353a"
}
