{
  "envVersion": "pqctoday.execution-environment/1",
  "recordedAt": "2026-09-25T15:34:55.004Z",
  "target": {
    "id": "kv260-cpp",
    "label": "AMD KV260 (CACP Yocto) — C++ engine",
    "class": "board"
  },
  "os": {
    "name": "AMD Embedded Development Framework Linux distribution 26.06+release-cb75a4c061568fe7fecd552a60b17af9c9e64cf1 (scarthgap)",
    "version": "26.06-release-cb75a4c061568fe7fecd552a60b17af9c9e64cf1",
    "kernel": "Linux 6.18.10-xilinx-g4f7afe14f724",
    "image": {
      "name": "CACP pqc-cacp-image k26-smk-kv-sdt-multidomain build 20260925131032 (AMD EDF 26.06 scarthgap)",
      "id": "wic.zst sha256:7cdec7d5c632e875c628959b58a657a168beda3a2d4362d631e5b0cdaf9d4810"
    }
  },
  "arch": {
    "machine": "aarch64",
    "pointerBits": 64,
    "endianness": "little"
  },
  "cpu": {
    "model": "ARMv8 CPU implementer 0x41 (Arm) part 0xd03",
    "board": "AMD Kria KV260 Vision AI Starter Kit, device-tree model ZynqMP KV260 revB, K26 SOM (Zynq UltraScale+ silicon id 0x04724093)",
    "features": "fp asimd aes pmull sha1 sha2 crc32 cpuid"
  },
  "emulation": {
    "emulated": false,
    "mechanism": null,
    "hostMachine": "bare metal (no hypervisor or container)",
    "detection": "/proc/self/maps rosetta mapping: absent; cpuinfo vendor_id: None"
  },
  "engine": {
    "id": "cpp",
    "implementation": "pqctoday-hsm softhsmv3 C++ (OpenSSL 3.6 backend), native shared library libsofthsmv3.so as installed by the CACP Yocto image (meta-pqc-hsm/recipes-crypto/softhsmv3/softhsmv3_git.bb)",
    "artifactKind": "shared-library",
    "artifactPath": "/usr/lib/softhsm/libsofthsmv3.so",
    "artifactSha256": "d4eb794a0520b894e76dbd26b0d36a1c6cf0a09fcb5c8b94a05aa1e71743e458",
    "sourceRepository": "https://github.com/pqctoday-org/pqctoday-hsm",
    "sourceCommit": "7f12c48d5e406c075076b5ea2eaf2d2de63c879b",
    "sourceCommitEvidence": "Not built for this run: the engine is the one installed by the board's current CACP Yocto image, run as found. Source commit from the image's BUILD-TIME records (pqctoday-cacp/out/k26/20260925131032/): SBOM pqc-cacp-image-k26-smk-kv-sdt-multidomain.rootfs-20260925131032.spdx.tar.zst (recipe-softhsmv3.spdx.json, recipe-softhsmrustv3.spdx.json) downloadLocation git+https://github.com/pqctoday-org/pqctoday-hsm.git@7f12c48d5e406c075076b5ea2eaf2d2de63c879b; image package manifest `softhsmv3 cortexa72_cortexa53 3.0.0+git0+7f12c48d5e`; recipe SRCREV = PQCTODAY_HSM_SRCREV (meta-pqc-hsm/conf/pqctoday-hsm-src.inc = 7f12c48d5e406c075076b5ea2eaf2d2de63c879b at cacp 520d7861, the clean revision stamped in build-metadata.json). The commit is an ancestor of pqctoday-hsm origin/main. On-board SHA-256 of /usr/lib/softhsm/libsofthsmv3.so (d4eb794a0520b894e76dbd26b0d36a1c6cf0a09fcb5c8b94a05aa1e71743e458) equals the same file extracted read-only (debugfs) from that bundle's .wic rootfs. The board runs that image: its root is SD card serial 0x00000231 and the kernel command line's root=PARTUUID=beb82b10-e9a3-49fd-b4e8-443a425f0198 equals the .wic's rootfs partition UUID.",
    "builtAt": null
  },
  "build": {
    "buildSystem": "CMake via Yocto cmake.bbclass (AMD EDF 2026.1, Yocto scarthgap), recipe softhsmv3_git.bb with one local patch 0001-include-cstdint-for-fixed-width-integer-types.patch",
    "compiler": "aarch64-amd-linux-g++, GCC 13.4.0 (image testdata.json GCCVERSION 13.%; libstdc++6 / libgcc1 13.4.0 in the image manifest; the installed .so is stripped, no ELF .comment)",
    "flags": "EXTRA_OECMAKE -DWITH_CRYPTO_BACKEND=openssl -DBUILD_TESTS=OFF -DENABLE_STATIC=OFF -DRUN_ECC=0 -DRUN_ED25519=0 -DRUN_ED448=0 -DRUN_AES_KEY_WRAP=0 -DRUN_AES_KEY_WRAP_PAD=0 -DRUN_RAWPSS=0; TARGET_CFLAGS -O2 -pipe -g; TUNE_CCARGS -mcpu=cortex-a72.cortex-a53+crc -mbranch-protection=standard (image testdata.json)",
    "profile": "Yocto cmake.bbclass defaults (CMAKE_BUILD_TYPE not set by the recipe); optimisation from TARGET_CFLAGS -O2",
    "features": "recipe sets no further CMake options (WITH_LIBOQS left at the project default)",
    "location": "Yocto cross-build (pqctoday-cacp tools/amd-build.sh), image build 20260925131032"
  },
  "dependencies": {
    "openssl": {
      "linked": true,
      "version": "OpenSSL 3.6.3 9 Jun 2026",
      "source": "OpenSSL_version(OPENSSL_VERSION) of /usr/lib/libcrypto.so.3, the only libcrypto mapped after loading the module"
    },
    "cryptoBackend": {
      "name": "OpenSSL libcrypto (EVP)",
      "version": "OpenSSL 3.6.3 9 Jun 2026"
    },
    "runtime": [
      {
        "name": "python",
        "version": "3.12.12"
      },
      {
        "name": "libc",
        "version": "glibc 2.39"
      }
    ]
  },
  "acceleration": {
    "state": "unknown",
    "detail": "unknown per plan decision D4 (no per-operation attestation). FPGA profile hashsig loaded (bitstream sha256 619571de6fc69f8febaaec8cf4cb92c8b95fab03693022fc0b4773ba34c44fde, SLH-DSA-SHAKE engine + behaviour TCN); the C++ engine has no FPGA driver path; OpenSSL CPUINFO: OPENSSL_armcap=0xbd"
  },
  "entropy": {
    "source": "OpenSSL 3.6.3 default DRBG, seeded from getrandom(2)",
    "exercisedByTestedOperations": false
  },
  "runner": {
    "name": "pqctoday acvp-native (Python/ctypes)",
    "version": "2.0.0",
    "language": "python",
    "languageVersion": "3.12.12"
  },
  "fixtureBundle": {
    "manifestSha256": "966ec2faeba6d85fe862b3bead4f0aebf47b784cecd472c2e5fb3a30905f444f",
    "schemaId": "ML-DSA/sigVer/FIPS204",
    "vsId": 42
  },
  "notes": [
    "Board: AMD Kria KV260 Vision AI Starter Kit, device-tree model 'ZynqMP KV260 revB' (compatible xlnx,zynqmp-sk-kv260-revB), K26 SOM, Zynq UltraScale+ silicon id 0x04724093 (/sys/devices/soc0/revision), 4× Cortex-A53 (CPU part 0xd03). The SOM/carrier FRU EEPROM was not read (needs root; not required).",
    "Image: CACP pqc-cacp-image for k26-smk-kv-sdt-multidomain, build id 20260925131032 (bundle pqctoday-cacp/out/k26/20260925131032/build-metadata.json), compressed WIC SHA-256 7cdec7d5c632e875c628959b58a657a168beda3a2d4362d631e5b0cdaf9d4810, cacp revision 520d78610019c1d2fe83c0d736d16cec1b518bcf, AMD EDF 2026.1. The board itself carries no build-identity file (/etc/version and /etc/timestamp are the reproducible-build constant 20180309123456), so the build id comes from the cacp records tied above.",
    "FPGA at run time (read from the board, unchanged): fpga_manager state 'operating'; /run/pqc/fpga-profile.state active=hashsig result=ok, bitstream_sha256 619571de6fc69f8febaaec8cf4cb92c8b95fab03693022fc0b4773ba34c44fde ('SLH-DSA-SHAKE s-set engine, 4 Keccak lanes, 240 MHz (engine v12b, no SHA-2) + behaviour TCN'), equal to build-metadata.json fpga_profiles.hashsig; UIO devices hashsig@a0100000 and behaviour@a0060000.",
    "Reached over the lab LAN: 192.168.4.53 on the Mac's en0 (192.168.4.0/22), MAC 00:0a:35:2b:9d:f4 (Xilinx OUI), SSH admin with the operator key. Read-only: runner and bundle staged in a private mktemp dir under /tmp (tmpfs) and removed afterwards; engine-side persistence/logging env vars (SOFTHSMRUST_STATE_FILE, PQC_BEHAVIOUR_RING, PQC_BEHAVIOUR_SRC, PQC_AUTH_LOG, SOFTHSM3_OP_LOG) explicitly unset, so the run used a private in-memory/tmp token and did not touch the appliance's token store or behaviour ring; PQC_HW_DISABLE / PQC_AWSLC_PQ_DISABLE not set (engine defaults). Board clock NTP-synchronised at run time.",
    "OpenSSL: the image's libcrypto3/openssl 3.6.3 package (/usr/lib/libcrypto.so.3); /usr/lib/ssl-3/openssl.cnf activates no provider or engine beyond the implicit default (the pkcs11.so provider module is installed but not activated).",
    "The C++ engine has no FPGA driver path (the cacp FPGA plan routes accelerator callers through the Rust engine only); acceleration is nevertheless recorded as 'unknown' for every KV260 target per plan decision D4, pending a per-operation attestation.",
    "builtAt left null: the image build id 20260925131032 is the bitbake start stamp, and the engine file mtime is clamped to SOURCE_DATE_EPOCH.",
    "C_GetInfo: cryptoki 3.2, manufacturer 'SoftHSM', library 'Implementation of PKCS11' 3.0"
  ],
  "envId": "9504eee6101b4bf2b8583f261dc4decc8af4ac1ac5ee2830a5acdcde68b06f79"
}
