{
  "envVersion": "pqctoday.execution-environment/1",
  "recordedAt": "2026-09-25T15:33:21.835Z",
  "target": {
    "id": "macos-arm64-rust",
    "label": "Native macOS arm64 — Rust engine",
    "class": "native"
  },
  "os": {
    "name": "macOS 26.6.2 (build 25G83)",
    "version": "26.6.2",
    "kernel": "Darwin 25.6.0",
    "image": {
      "name": null,
      "id": null
    }
  },
  "arch": {
    "machine": "arm64",
    "pointerBits": 64,
    "endianness": "little"
  },
  "cpu": {
    "model": "Apple M5 Max",
    "board": null,
    "features": "FEAT_CRC32 FEAT_FlagM FEAT_FlagM2 FEAT_FHM FEAT_DotProd FEAT_SHA3 FEAT_RDM FEAT_LSE FEAT_SHA256 FEAT_SHA512 FEAT_SHA1 FEAT_AES FEAT_PMULL FEAT_SB FEAT_FRINTTS FEAT_PACIMP FEAT_LRCPC FEAT_LRCPC2 FEAT_FCMA FEAT_JSCVT FEAT_PAuth FEAT_PAuth2 FEAT_FPAC FEAT_FPACCOMBINE FEAT_DPB FEAT_DPB2 FEAT_BF16 FEAT_EBF16 FEAT_I8MM FEAT_WFxT FEAT_RPRES FEAT_CSSC FEAT_HBC FEAT_ECV FEAT_AFP FEAT_LSE2 FEAT_CSV2 FEAT_CSV3 FEAT_DIT AdvSIMD AdvSIMD_HPFPCvt FEAT_FP16 FEAT_BTI FEAT_SME FEAT_SME2 FEAT_SME2p1 FEAT_MTE FEAT_MTE2 FEAT_MTE4 FEAT_MTE_STORE_ONLY SME_F32F32 SME_BI32I32 SME_B16F32 SME_F16F32 SME_I8I32 SME_I16I32 FEAT_SME_F64F64 FEAT_SME_I16I64 FEAT_SME_F16F16 FEAT_SME_B16B16 FEAT_SVE_B16B16 FP_SyncExceptions FEAT_MTE_CANONICAL_TAGS FEAT_MTE_NO_ADDRESS_TAGS floatingpoint neon neon_hpfp neon_fp16 armv8_crc32 armv8_gpi armv8_1_atomics armv8_2_fhm armv8_2_sha512 armv8_2_sha3 armv8_3_compnum ucnormal_mem arm64"
  },
  "emulation": {
    "emulated": false,
    "mechanism": null,
    "hostMachine": "arm64 (Apple M5 Max, macOS 26.6.2, bare metal — no VM, no container)",
    "detection": "sysctl.proc_translated: 0; hw.machine: arm64"
  },
  "engine": {
    "id": "rust",
    "implementation": "pqctoday-hsm softhsmrustv3 (Rust), native macOS cdylib libsofthsmrustv3.dylib",
    "artifactKind": "shared-library",
    "artifactPath": "/private/tmp/claude-501/-Users-pqctoday-Antigravity/2eec9d99-456c-46d5-b3af-4e835670dc75/scratchpad/engines-0925/macos-arm64-libsofthsmrustv3.dylib",
    "artifactSha256": "0eef6de33a3d0fe3eb48a940a3f9b476fb60622ac0a37f4fe452297aaa251fe3",
    "sourceRepository": "https://github.com/pqctoday-org/pqctoday-hsm",
    "sourceCommit": "417c47a224a9859a4a02b90700ca0cdeb30cfebc",
    "sourceCommitEvidence": "Built from a clean detached worktree created for this run (git -C pqctoday-hsm worktree add --detach pqctoday-hsm-mac-417c47a2 417c47a2…; no submodules needed). `git status --porcelain` was empty before and after; the worktree was removed afterwards. Same commit the Rust WASM bundle is anchored to (wasm-provenance.json softhsmrustv3-engine._reanchor20260923: byte-identical rebuild).",
    "builtAt": "2026-09-25T15:28Z"
  },
  "build": {
    "buildSystem": "cargo 1.96.0 (30a34c682 2026-05-25): cargo build --release --locked -p softhsmrustv3 --lib (private CARGO_TARGET_DIR)",
    "compiler": "rustc 1.96.0 (ac68faa20 2026-05-25), host aarch64-apple-darwin, LLVM 22.1.2 — rustup toolchain 1.96.0-aarch64-apple-darwin invoked by absolute path (~/.cargo/bin not on PATH); C build-deps (aws-lc-sys and others) compiled by Apple clang 21.0.0 (clang-2100.3.34.2), Xcode 27.0 (27A266a), macOS SDK 27.0",
    "flags": "RUSTFLAGS unset; environment reset to PATH=<toolchain>/bin:/opt/homebrew/bin:/usr/bin:/bin:/usr/sbin:/sbin",
    "profile": "release (opt-level=\"s\", lto=true — rust/Cargo.toml [profile.release])",
    "features": "default (no acvp, no hw-accel) — the shipped native feature set; the WASM bundle additionally enables acvp (C_Initialize pReserved RNG-seeding hook, unused: both runners pass NULL)",
    "location": "macOS host (Apple M5 Max, macOS 26.6.2 build 25G83), native arm64 with the host Rust toolchain + Xcode — permitted for the macOS row only (acvp-gap-closure plan §P4); CARGO_TARGET_DIR in the session scratchpad, removed after the runs"
  },
  "dependencies": {
    "openssl": {
      "linked": false,
      "version": null,
      "source": "no libcrypto newly mapped by loading the module (pre-mapped by the interpreter, not bound by it: /usr/lib/libcrypto.46.dylib) after loading /private/tmp/claude-501/-Users-pqctoday-Antigravity/2eec9d99-456c-46d5-b3af-4e835670dc75/scratchpad/engines-0925/macos-arm64-libsofthsmrustv3.dylib (dyld image list)"
    },
    "cryptoBackend": {
      "name": "RustCrypto ml-kem (patched: rust/ml-kem-patched) + fips204 (patched: rust/fips204-patched)",
      "version": "ml-kem 0.2.3, fips204 0.4.6 (rust/Cargo.lock @ 417c47a2)"
    },
    "runtime": [
      {
        "name": "python",
        "version": "3.14.5"
      },
      {
        "name": "libc",
        "version": "libSystem.B.dylib (macOS 26.6.2)"
      }
    ]
  },
  "acceleration": {
    "state": "none",
    "detail": "no hardware accelerator (no FPGA/NPU/crypto offload); CPU ISA extensions only"
  },
  "entropy": {
    "source": "getrandom crate (0.2.17 / 0.4.2 in rust/Cargo.lock) → macOS system entropy",
    "exercisedByTestedOperations": false
  },
  "runner": {
    "name": "pqctoday acvp-native (Python/ctypes)",
    "version": "2.1.0",
    "language": "python",
    "languageVersion": "3.14.5"
  },
  "fixtureBundle": {
    "manifestSha256": "966ec2faeba6d85fe862b3bead4f0aebf47b784cecd472c2e5fb3a30905f444f",
    "schemaId": "ML-DSA/sigVer/FIPS204",
    "vsId": 42
  },
  "notes": [
    "aws-lc-rs (aws-lc-sys) is statically linked for the RSA / NIST-curve ECDH fast path only (rust/src/crypto/awslc.rs); ML-KEM decapsulation and ML-DSA verification run on the pure-Rust crates. The dylib links no libcrypto (otool -L: libiconv, libSystem only).",
    "hw-accel feature OFF: no FPGA/NPU offload path is compiled in.",
    "Crates: the first build fetched with --locked from crates.io into the host ~/.cargo registry (the host cache lacked rustls 0.23.45); the rebuild ran --offline.",
    "Reproducibility: the Mach-O install name embeds the absolute CARGO_TARGET_DIR path, so a rebuild is only comparable at the same path. The target dir was deleted and rebuilt from scratch at the same path; the SHA-256 was identical (0eef6de33a3d0fe3eb48a940a3f9b476fb60622ac0a37f4fe452297aaa251fe3).",
    "C_GetInfo: cryptoki 3.2, manufacturer 'SoftHSMv3 Rust WASM', library 'PQC PKCS#11 v3.2 Rust WASM' 3.0"
  ],
  "envId": "e161b265ad3b004e1a8673c3c0a59e017efa689e42491903d2e990a80ae26e6e"
}
